[
  {
    "handle": "@228sandy",
    "name": "",
    "region": "宜蘭",
    "product": "白米",
    "price": "",
    "address": "",
    "season": "",
    "min": "",
    "ship": "",
    "buy": "",
    "contact": "",
    "order_url": "",
    "cert": "",
    "cert_link": "",
    "intro": "",
    "note": "",
    "url": "",
    "category": "米糧",
    "verified": "",
    "created_at": "2026-03-29",
    "updated_at": "2026-04-15"
  },
  {
    "handle": "@2wsx36951",
    "name": "",
    "region": "宜蘭",
    "product": "有機地瓜",
    "price": "",
    "address": "",
    "season": "",
    "min": "",
    "ship": "",
    "buy": "",
    "contact": "",
    "order_url": "",
    "cert": "有機",
    "cert_link": "",
    "intro": "",
    "note": "",
    "url": "",
    "category": "米糧",
    "verified": "",
    "created_at": "2026-03-29",
    "updated_at": "2026-04-15"
  },
  {
    "handle": "@to_get_her2018",
    "name": "",
    "region": "宜蘭",
    "product": "櫛瓜、大蔥",
    "price": "",
    "address": "",
    "season": "",
    "min": "",
    "ship": "",
    "buy": "",
    "contact": "",
    "order_url": "",
    "cert": "",
    "cert_link": "",
    "intro": "",
    "note": "",
    "url": "",
    "category": "蔬菜",
    "verified": "",
    "created_at": "2026-03-29",
    "updated_at": "2026-04-15"
  },
  {
    "handle": "@guobafarm",
    "name": "",
    "region": "新竹",
    "product": "桃子、柿子（尖石後山）",
    "price": "",
    "address": "",
    "season": "",
    "min": "",
    "ship": "",
    "buy": "",
    "contact": "",
    "order_url": "",
    "cert": "",
    "cert_link": "",
    "intro": "",
    "note": "",
    "url": "",
    "category": "水果",
    "verified": "",
    "created_at": "2026-03-29",
    "updated_at": "2026-04-15"
  },
  {
    "handle": "@kiki__vanilla",
    "name": "",
    "region": "桃園",
    "product": "有機櫛瓜、有機羽衣甘藍、彩色花椰菜（大溪）",
    "price": "",
    "address": "",
    "season": "",
    "min": "",
    "ship": "",
    "buy": "私訊",
    "contact": "",
    "order_url": "",
    "cert": "有機",
    "cert_link": "",
    "intro": "",
    "note": "",
    "url": "",
    "category": "蔬菜",
    "verified": "",
    "created_at": "2026-03-29",
    "updated_at": "2026-04-15"
  },
  {
    "handle": "@zhong.sen_",
    "name": "",
    "region": "嘉義",
    "product": "花生",
    "price": "",
    "address": "",
    "season": "",
    "min": "",
    "ship": "",
    "buy": "",
    "contact": "",
    "order_url": "",
    "cert": "",
    "cert_link": "",
    "intro": "",
    "note": "",
    "url": "",
    "category": "蔬菜",
    "verified": "",
    "created_at": "2026-03-29",
    "updated_at": "2026-04-15"
  },
  {
    "handle": "@krista0427",
    "name": "",
    "region": "嘉義",
    "product": "小辣椒",
    "price": "",
    "address": "",
    "season": "",
    "min": "",
    "ship": "",
    "buy": "",
    "contact": "",
    "order_url": "",
    "cert": "",
    "cert_link": "",
    "intro": "",
    "note": "",
    "url": "",
    "category": "蔬菜",
    "verified": "",
    "created_at": "2026-03-29",
    "updated_at": "2026-04-15"
  },
  {
    "handle": "@lushun_asparagus",
    "name": "",
    "region": "嘉義",
    "product": "綠蘆筍",
    "price": "",
    "address": "",
    "season": "",
    "min": "",
    "ship": "",
    "buy": "私訊表單",
    "contact": "",
    "order_url": "",
    "cert": "",
    "cert_link": "",
    "intro": "",
    "note": "",
    "url": "",
    "category": "蔬菜",
    "verified": "",
    "created_at": "2026-03-29",
    "updated_at": "2026-04-15"
  },
  {
    "handle": "@lwsocialenterprise",
    "name": "",
    "region": "嘉義",
    "product": "綠蘆筍",
    "price": "",
    "address": "",
    "season": "",
    "min": "",
    "ship": "",
    "buy": "",
    "contact": "",
    "order_url": "",
    "cert": "",
    "cert_link": "",
    "intro": "",
    "note": "",
    "url": "",
    "category": "蔬菜",
    "verified": "",
    "created_at": "2026-03-29",
    "updated_at": "2026-04-15"
  },
  {
    "handle": "@enen3154",
    "name": "",
    "region": "嘉義",
    "product": "洋蔥",
    "price": "7斤$320 / 16斤$590 / 30斤$1000（含運）",
    "address": "",
    "season": "",
    "min": "7斤起",
    "ship": "",
    "buy": "私訊",
    "contact": "",
    "order_url": "",
    "cert": "農藥未檢出",
    "cert_link": "",
    "intro": "",
    "note": "",
    "url": "",
    "category": "蔬菜",
    "verified": "",
    "created_at": "2026-03-29",
    "updated_at": "2026-04-15"
  },
  {
    "handle": "@mengtianfarm",
    "name": "",
    "region": "嘉義",
    "product": "水果小黃瓜",
    "price": "",
    "address": "",
    "season": "",
    "min": "",
    "ship": "",
    "buy": "私訊",
    "contact": "",
    "order_url": "",
    "cert": "",
    "cert_link": "",
    "intro": "",
    "note": "",
    "url": "",
    "category": "蔬菜",
    "verified": "",
    "created_at": "2026-03-29",
    "updated_at": "2026-04-15"
  },
  {
    "handle": "@guoran_daily",
    "name": "果然日常",
    "region": "嘉義",
    "product": "紅肉甜橙、帝王柑、芭樂、檸檬",
    "price": "",
    "address": "",
    "season": "",
    "min": "",
    "ship": "",
    "buy": "",
    "contact": "",
    "order_url": "",
    "cert": "",
    "cert_link": "",
    "intro": "",
    "note": "",
    "url": "",
    "category": "水果",
    "verified": "",
    "created_at": "2026-03-29",
    "updated_at": "2026-04-15"
  },
  {
    "handle": "@mountain_chicken888",
    "name": "",
    "region": "台南",
    "product": "放山雞",
    "price": "",
    "address": "",
    "season": "",
    "min": "",
    "ship": "",
    "buy": "",
    "contact": "",
    "order_url": "",
    "cert": "",
    "cert_link": "",
    "intro": "",
    "note": "",
    "url": "",
    "category": "蛋肉",
    "verified": "",
    "created_at": "2026-03-29",
    "updated_at": "2026-04-15"
  },
  {
    "handle": "@passonthetreasure",
    "name": "",
    "region": "台南",
    "product": "絲瓜筍",
    "price": "",
    "address": "",
    "season": "",
    "min": "",
    "ship": "",
    "buy": "",
    "contact": "",
    "order_url": "",
    "cert": "",
    "cert_link": "",
    "intro": "",
    "note": "",
    "url": "",
    "category": "蔬菜",
    "verified": "",
    "created_at": "2026-03-29",
    "updated_at": "2026-04-15"
  },
  {
    "handle": "@koo060060",
    "name": "香菇如姐",
    "region": "台中",
    "product": "新鮮香菇、乾香菇、香菇禮盒",
    "price": "",
    "address": "",
    "season": "",
    "min": "",
    "ship": "",
    "buy": "私訊/IG",
    "contact": "",
    "order_url": "",
    "cert": "",
    "cert_link": "",
    "intro": "",
    "note": "",
    "url": "",
    "category": "蔬菜",
    "verified": "",
    "created_at": "2026-03-29",
    "updated_at": "2026-04-15"
  },
  {
    "handle": "@chih__sheng",
    "name": "",
    "region": "台南",
    "product": "地瓜",
    "price": "",
    "address": "",
    "season": "",
    "min": "",
    "ship": "",
    "buy": "",
    "contact": "",
    "order_url": "",
    "cert": "",
    "cert_link": "",
    "intro": "",
    "note": "",
    "url": "",
    "category": "米糧",
    "verified": "",
    "created_at": "2026-03-29",
    "updated_at": "2026-04-15"
  },
  {
    "handle": "@yt_1203",
    "name": "",
    "region": "苗栗",
    "product": "番茄（卓蘭）",
    "price": "",
    "address": "",
    "season": "",
    "min": "",
    "ship": "",
    "buy": "",
    "contact": "",
    "order_url": "",
    "cert": "",
    "cert_link": "",
    "intro": "",
    "note": "",
    "url": "",
    "category": "蔬菜",
    "verified": "",
    "created_at": "2026-03-29",
    "updated_at": "2026-04-15"
  },
  {
    "handle": "@alice60577",
    "name": "",
    "region": "台中",
    "product": "玉米筍",
    "price": "",
    "address": "",
    "season": "",
    "min": "",
    "ship": "",
    "buy": "",
    "contact": "",
    "order_url": "",
    "cert": "",
    "cert_link": "",
    "intro": "",
    "note": "",
    "url": "",
    "category": "米糧",
    "verified": "",
    "created_at": "2026-03-29",
    "updated_at": "2026-04-15"
  },
  {
    "handle": "@kevin7892001",
    "name": "",
    "region": "台中",
    "product": "韓國櫛瓜",
    "price": "",
    "address": "",
    "season": "",
    "min": "",
    "ship": "",
    "buy": "",
    "contact": "",
    "order_url": "",
    "cert": "",
    "cert_link": "",
    "intro": "",
    "note": "",
    "url": "",
    "category": "蔬菜",
    "verified": "",
    "created_at": "2026-03-29",
    "updated_at": "2026-04-15"
  },
  {
    "handle": "@m948avia",
    "name": "",
    "region": "台中",
    "product": "韓國櫛瓜",
    "price": "",
    "address": "",
    "season": "",
    "min": "",
    "ship": "",
    "buy": "",
    "contact": "",
    "order_url": "",
    "cert": "",
    "cert_link": "",
    "intro": "",
    "note": "",
    "url": "",
    "category": "蔬菜",
    "verified": "",
    "created_at": "2026-03-29",
    "updated_at": "2026-04-15"
  },
  {
    "handle": "@mumu_farmer",
    "name": "",
    "region": "台中",
    "product": "大安芋頭",
    "price": "",
    "address": "",
    "season": "",
    "min": "",
    "ship": "",
    "buy": "",
    "contact": "",
    "order_url": "",
    "cert": "",
    "cert_link": "",
    "intro": "",
    "note": "",
    "url": "",
    "category": "蔬菜",
    "verified": "",
    "created_at": "2026-03-29",
    "updated_at": "2026-04-15"
  },
  {
    "handle": "@samhighhung",
    "name": "",
    "region": "彰化",
    "product": "高麗菜",
    "price": "",
    "address": "",
    "season": "",
    "min": "",
    "ship": "",
    "buy": "",
    "contact": "",
    "order_url": "",
    "cert": "",
    "cert_link": "",
    "intro": "",
    "note": "",
    "url": "",
    "category": "蔬菜",
    "verified": "",
    "created_at": "2026-03-29",
    "updated_at": "2026-04-15"
  },
  {
    "handle": "@vegetable0722",
    "name": "",
    "region": "彰化",
    "product": "黑柿番茄",
    "price": "",
    "address": "",
    "season": "",
    "min": "",
    "ship": "",
    "buy": "",
    "contact": "",
    "order_url": "",
    "cert": "",
    "cert_link": "",
    "intro": "",
    "note": "",
    "url": "",
    "category": "蔬菜",
    "verified": "",
    "created_at": "2026-03-29",
    "updated_at": "2026-04-15"
  },
  {
    "handle": "@duffy_kittybaby",